{
  "$schema": "https://json-schema.org/draft/2020-12/schema",
  "$id": "https://raw.githubusercontent.com/pentaxis93/groundwork/main/schemas/issue.schema.json",
  "title": "Issue",
  "description": "Validates the content of an issue artifact. A work unit decomposed from requirements, with acceptance criteria that thread through the entire execution phase.",
  "type": "object",
  "required": ["title", "description", "acceptance_criteria"],
  "additionalProperties": false,
  "properties": {
    "title": {
      "type": "string",
      "description": "What this work unit is.",
      "minLength": 1
    },
    "description": {
      "type": "string",
      "description": "What needs doing.",
      "minLength": 1
    },
    "acceptance_criteria": {
      "type": "array",
      "description": "Discrete, verifiable conditions for done.",
      "minItems": 1,
      "items": {
        "type": "string"
      }
    },
    "dependencies": {
      "type": "array",
      "description": "Issues that must be complete before this starts.",
      "items": {
        "type": "string",
        "pattern": "^[a-z][a-z0-9]*([-.][a-z0-9]+)*$"
      }
    }
  }
}
